{
  "schema_version": 1,
  "deployment": {
    "listener": { "address": "127.0.0.1:0" },
    "upstream": { "provider": "openai" },
    "local_auth": { "mode": "token", "token": { "file": "@TOKEN_FILE@" } }
  },
  "content": { "profile": "full" },
  "resources": {
    "capacity": { "receipt": 8, "memory_units": 65536, "inspection": 2, "upstream": 8, "stream": 8 }
  }
}
