{
  "schema_version": 1,
  "deployment": {
    "listener": {
      "address": "127.0.0.1:8787"
    },
    "upstream": {
      "provider": "openai"
    }
  },
  "content": {
    "profile": "common",
    "pii": [
      "pii:family:global:email"
    ],
    "on_warn": "forward",
    "max_findings": 50000
  },
  "resources": {
    "capacity": {
      "receipt": 8,
      "memory_units": 65536,
      "inspection": 2,
      "upstream": 8,
      "stream": 8
    }
  }
}
