{
  "schema_version": 1,
  "deployment": {
    "listener": {
      "address": "127.0.0.1:8787"
    },
    "upstream": {
      "provider": "openai"
    },
    "local_auth": {
      "mode": "token",
      "token": {
        "env": "GATEWAY_LOCAL_TOKEN"
      }
    }
  },
  "content": {
    "profile": "full"
  },
  "resources": {
    "capacity": {
      "receipt": 8,
      "memory_units": 65536,
      "inspection": 2,
      "upstream": 8,
      "stream": 8
    }
  }
}
